<?xml version="1.0" encoding="utf-8"?>
<cidade xmlns:xsi="http://www.w3.org/2001/XMLSchema-instance" xsi:schemaLocation="https://github.com/iclodoaldo/trabalhoXml2/blob/master/src/XSD_ex_2.xsd"><nome>Arraial do Cabo</nome><uf>RJ</uf><atualizacao>2015-09-09</atualizacao><dia data="2015-09-10"><manha><altura>1.6</altura></manha><tarde><altura>1.4</altura></tarde><noite><agitacao>Fraco</agitacao><altura>1.3</altura></noite><media>23.0</media></dia><dia data="2015-09-11"><manha><altura>1.0</altura></manha><tarde><altura>1.0</altura></tarde><noite><agitacao>Fraco</agitacao><altura>1.1</altura></noite><media>26.0</media></dia><dia data="2015-09-12"><manha><altura>1.8</altura></manha><tarde><altura>1.5</altura></tarde><noite><agitacao>Fraco</agitacao><altura>1.4</altura></noite><media>23.0</media></dia><dia data="2015-09-13"><manha><altura>1.6</altura></manha><tarde><altura>1.4</altura></tarde><noite><agitacao>Fraco</agitacao><altura>1.3</altura></noite><media>22.5</media></dia><dia data="2015-09-14"><manha><altura>1.6</altura></manha><tarde><altura>1.4</altura></tarde><noite><agitacao>Fraco</agitacao><altura>1.3</altura></noite><media>22.5</media></dia><dia data="2015-09-15"><manha><altura>1.6</altura></manha><tarde><altura>1.4</altura></tarde><noite><agitacao>Fraco</agitacao><altura>1.3</altura></noite><media>24.0</media></dia></cidade>